{
  "schema_version": "highambench-faithfulness-0.2",
  "role": "direct-judge",
  "task_id": "P17-T2",
  "paper_sha256": "df1ce5dd33285adfcffc6a4c7ab94f9604b46739cb848c6cbb5f997e8fac597d",
  "dossier_sha256": "5193411242693d04316eb204049b12487eb2d97d5828cf77faa67fbfd9b36db3",
  "dependency_coverage": [
    {
      "id": "D001",
      "name": "HighamBench.P17LimitedPrecisionRecursiveSumRun",
      "interpretation": "A packaged finite-probability recursive-summation execution with m rounded additions.",
      "effect_on_target": "It supplies the input, precisions, probability law, local errors, and model assumptions quantified by the theorem.",
      "paper_match": "It models the data used for the paper's left-to-right SR_{p,r} computation with n=m+1.",
      "status": "pass"
    },
    {
      "id": "D002",
      "name": "HighamBench.P17LimitedPrecisionRecursiveSumRun.a",
      "interpretation": "The run's real input vector, indexed by Fin (m+1).",
      "effect_on_target": "It is used by the exact sum, computed recursion, and condition number.",
      "paper_match": "Fin (m+1) represents a_1 through a_n with n=m+1.",
      "status": "pass"
    },
    {
      "id": "D003",
      "name": "HighamBench.P17LimitedPrecisionRecursiveSumRun.p",
      "interpretation": "The target floating-point precision as a natural number.",
      "effect_on_target": "Together with r it determines the bias unit roundoff.",
      "paper_match": "It corresponds to the paper's positive precision p.",
      "status": "pass"
    },
    {
      "id": "D004",
      "name": "HighamBench.P17LimitedPrecisionRecursiveSumRun.r",
      "interpretation": "The positive number of additional random bits.",
      "effect_on_target": "It enters p+r in the bias factor.",
      "paper_match": "It matches the paper's limited-random-bit parameter r.",
      "status": "pass"
    },
    {
      "id": "D005",
      "name": "HighamBench.p17ExactSum",
      "interpretation": "The sum of all components over Finset.univ.",
      "effect_on_target": "It defines y, the denominator, and the nonzero hypothesis.",
      "paper_match": "It is exactly y=sum_i a_i from equation (4.1).",
      "status": "pass"
    },
    {
      "id": "D006",
      "name": "HighamBench.p17ExpectedRecursiveSum",
      "interpretation": "The finite weighted expectation of the recursively computed sum.",
      "effect_on_target": "It supplies E(hat_y) in the bias numerator.",
      "paper_match": "It matches the expectation of the quantity hat_y in equation (4.4).",
      "status": "pass"
    },
    {
      "id": "D007",
      "name": "HighamBench.p17Gamma",
      "interpretation": "p17Gamma n u is (1+u)^n-1 using exact natural powers.",
      "effect_on_target": "It is the complete accumulated bias factor on the right-hand side.",
      "paper_match": "It exactly matches gamma_n(u) in equation (4.3), with no dropped higher-order terms.",
      "status": "pass"
    },
    {
      "id": "D008",
      "name": "HighamBench.p17SummationCondition",
      "interpretation": "The componentwise l1 sum of absolute inputs divided by the absolute exact sum.",
      "effect_on_target": "It supplies kappa(a) in the bound.",
      "paper_match": "It exactly matches equation (4.2).",
      "status": "pass"
    },
    {
      "id": "D009",
      "name": "HighamBench.p17UnitRoundoff",
      "interpretation": "For natural p it is (1/2)^(p-1), with natural subtraction.",
      "effect_on_target": "At p+r it yields the local conditional-bias bound used by gamma.",
      "paper_match": "Because run.p and run.r are positive, it equals 2^(1-p-r)=u_{p+r}.",
      "status": "pass"
    },
    {
      "id": "D010",
      "name": "HighamBench.P17LimitedPrecisionRecursiveSumRun.delta",
      "interpretation": "A path-dependent real relative error for each of the m rounded additions.",
      "effect_on_target": "These errors determine every computed recursive-sum realization.",
      "paper_match": "Lean index k corresponds to the paper's delta_{k+1} under zero-based indexing.",
      "status": "pass"
    },
    {
      "id": "D011",
      "name": "HighamBench.P17LimitedPrecisionRecursiveSumRun.mk",
      "interpretation": "The constructor requires a normalized finite probability, positive p and r, an m+1 input, delta and beta processes, a deterministic truncation map, delta and beta bounds, nonnegative rounding factors, the truncation equation, zero-result conventions, beta history dependence, and the conditional-mean test-function identity.",
      "effect_on_target": "It provides the complete sufficient error model for applying the product-expectation argument to recursive summation.",
      "paper_match": "The bounds, zero convention, history dependence, and conditional mean match Lemma 3.2 and Theorem 3.6. It omits the Bernoulli/enclosing-value implementation details, thereby generalizing beyond actual SR_{p,r} while retaining all properties needed for Theorem 4.1.",
      "status": "pass"
    },
    {
      "id": "D012",
      "name": "HighamBench.P17LimitedPrecisionRecursiveSumRun.probability",
      "interpretation": "The finite probability distribution attached to a run.",
      "effect_on_target": "It weights the expected computed sum and all conditional-mean identities.",
      "paper_match": "It represents the probability law of the finite sequence of SR decisions.",
      "status": "pass"
    },
    {
      "id": "D013",
      "name": "HighamBench.p17Expectation",
      "interpretation": "Expectation is the finite sum of probability times value over all outcomes.",
      "effect_on_target": "It gives the precise meaning of E(hat_y).",
      "paper_match": "A finite SR decision tree has exactly this discrete expectation.",
      "status": "pass"
    },
    {
      "id": "D014",
      "name": "HighamBench.p17RecursiveSum",
      "interpretation": "Starting from a[0], it folds k=0,...,m-1 by acc := (acc+a[k+1])*(1+delta[k]).",
      "effect_on_target": "It defines each realization of the computed result.",
      "paper_match": "It is exactly the left-to-right recurrence for hat_s_1 through hat_s_n with n=m+1.",
      "status": "pass"
    },
    {
      "id": "D015",
      "name": "HighamBench.p17UnitRoundoff._proof_1",
      "interpretation": "A typeclass proof that the numeral 2 is at least two.",
      "effect_on_target": "It only permits elaboration of the real numeral 2 in the unit-roundoff definition.",
      "paper_match": "It has no independent mathematical counterpart in the paper.",
      "status": "not-applicable"
    },
    {
      "id": "D016",
      "name": "HighamBench.P17FiniteProbability",
      "interpretation": "A finite probability mass function packaged with normalization and nonnegativity proofs.",
      "effect_on_target": "It fixes the probability semantics of all expectations.",
      "paper_match": "The finitely many outcomes of m Bernoulli rounding decisions admit such a representation.",
      "status": "pass"
    },
    {
      "id": "D017",
      "name": "HighamBench.P17FiniteProbability.prob",
      "interpretation": "The real probability mass assigned to each outcome.",
      "effect_on_target": "It is the weight in each expectation summand.",
      "paper_match": "It has the standard probability-mass interpretation used for SR outcomes.",
      "status": "pass"
    },
    {
      "id": "D018",
      "name": "HighamBench.p17HistoryMeasurable",
      "interpretation": "X is history-measurable at k when equal preceding delta values force equal X values.",
      "effect_on_target": "It restricts test functions in the conditional-mean identity and requires beta[k] to depend only on prior errors.",
      "paper_match": "On a finite space this expresses measurability with respect to delta_0 through delta_{k-1}, matching conditional expectation given preceding errors.",
      "status": "pass"
    },
    {
      "id": "D019",
      "name": "HighamBench.p17RecursivePreRound",
      "interpretation": "The accumulated rounded partial sum before step k plus the next exact input.",
      "effect_on_target": "It is the value to which delta[k], beta[k], and truncation assumptions apply.",
      "paper_match": "It matches hat_s_{k-1}+a_k after converting from paper indexing.",
      "status": "pass"
    },
    {
      "id": "D020",
      "name": "HighamBench.p17RecursiveSum._proof_1",
      "interpretation": "A proof that m+1 is nonzero.",
      "effect_on_target": "It only justifies the initial Fin index 0.",
      "paper_match": "It is elaboration plumbing rather than a separate paper assumption.",
      "status": "not-applicable"
    },
    {
      "id": "D021",
      "name": "HighamBench.P17FiniteProbability.mk",
      "interpretation": "It constructs a finite probability from nonnegative masses summing to one.",
      "effect_on_target": "It rules out unnormalized or signed expectation weights.",
      "paper_match": "These are exactly the probability axioms needed for the paper's expectation.",
      "status": "pass"
    },
    {
      "id": "D022",
      "name": "HighamBench.p17RecursiveSumBefore",
      "interpretation": "It folds only the steps strictly preceding k, starting at a[0].",
      "effect_on_target": "It makes the kth pre-round value depend only on prior delta errors.",
      "paper_match": "It reproduces the partial computed sum available before the next paper addition.",
      "status": "pass"
    },
    {
      "id": "D023",
      "name": "HighamBench.p17RecursiveSumBefore._proof_1",
      "interpretation": "An index-bound proof embedding an earlier fold index into Fin m.",
      "effect_on_target": "It has no numerical effect and only validates indexing.",
      "paper_match": "It is formal index bookkeeping with no separate paper content.",
      "status": "not-applicable"
    },
    {
      "id": "D024",
      "name": "DivInvMonoid.toDiv",
      "interpretation": "It supplies real division from multiplication and inversion.",